{
  "$schema": "https://json-schema.org/draft/2020-12/schema",
  "$id": "https://ways.dev/schemas/review-v1.json",
  "type": "object",
  "additionalProperties": false,
  "required": ["schemaVersion", "workId", "reviewer", "digest", "verdict", "findings"],
  "properties": {
    "schemaVersion": { "const": 1 },
    "workId": { "type": "string", "minLength": 1 },
    "taskId": { "type": "string", "minLength": 1 },
    "attempt": { "type": "integer", "minimum": 0, "maximum": 9007199254740991 },
    "reviewer": { "type": "string", "minLength": 1 },
    "digest": { "type": "string", "pattern": "^[0-9a-f]{64}$" },
    "verdict": { "enum": ["pass", "fail"] },
    "findings": {
      "type": "array",
      "items": {
        "type": "object",
        "additionalProperties": false,
        "required": ["id", "severity", "summary", "disposition"],
        "properties": {
          "id": { "type": "string", "minLength": 1 },
          "severity": { "enum": ["critical", "high", "medium", "low"] },
          "summary": { "type": "string", "minLength": 1 },
          "disposition": { "enum": ["open", "fixed", "accepted", "deferred"] }
        }
      }
    }
  }
}
