{
  "schemaVersion": 1,
  "workId": "human-approvals",
  "reviewer": "ways-reviewer",
  "digest": "a2b5c5adb650a44ecda8d5c233fb01ab49c9d2b4c3e03e6acd903209633ff99f",
  "verdict": "pass",
  "findings": [
    {
      "id": "R1",
      "severity": "critical",
      "summary": "hook rejected legitimate supervised plan certifications; now bound to the committed state's gateCommit",
      "disposition": "fixed"
    },
    {
      "id": "R2",
      "severity": "critical",
      "summary": "hook rejected legitimate supervised close; the close approval is committed first and its deletion verified",
      "disposition": "fixed"
    },
    {
      "id": "R3",
      "severity": "high",
      "summary": "tests never drove a supervised work past intake; full flow through the real hook added",
      "disposition": "fixed"
    },
    {
      "id": "R4",
      "severity": "high",
      "summary": "profile flip on disk bypassed the gate; supervised work opens with a traced commit and disk profile must match",
      "disposition": "fixed"
    },
    {
      "id": "R5",
      "severity": "high",
      "summary": "TTY-free writer was exported; made internal, docs state shell fabrication remains unverifiable",
      "disposition": "fixed"
    },
    {
      "id": "R6",
      "severity": "medium",
      "summary": "guard blocked reads and missed writes; now write-shaped commands only, evasions documented",
      "disposition": "fixed"
    },
    {
      "id": "R7",
      "severity": "medium",
      "summary": "advance is not transactional before its commit; pre-existing, documented in HANDOFF",
      "disposition": "accepted"
    },
    {
      "id": "R8",
      "severity": "low",
      "summary": "digest exclusions duplicated between pathspec and isBookkeeping",
      "disposition": "accepted"
    },
    {
      "id": "R9",
      "severity": "low",
      "summary": "misleading hook message, resolved with R1",
      "disposition": "fixed"
    },
    {
      "id": "R10",
      "severity": "high",
      "summary": "renaming the work on disk shed the committed profile; disk state must match committed id, baseCommit and profile; abandoned openings audited",
      "disposition": "fixed"
    },
    {
      "id": "R11",
      "severity": "low",
      "summary": "promotePlan supervised opening untested; test added",
      "disposition": "fixed"
    },
    {
      "id": "R12",
      "severity": "low",
      "summary": "mode flip on disk yields untraced-looking commits but cannot pass a gate; to be documented in a follow-up",
      "disposition": "accepted"
    }
  ]
}
