{
  "schemaVersion": 1,
  "workId": "provider-adapters",
  "reviewer": "ways-reviewer",
  "digest": "ca06acba34843eab8f210a3defe478f0a35ca57dc7e9631f6282cc00237dc0aa",
  "verdict": "pass",
  "findings": [
    {
      "id": "R1",
      "severity": "high",
      "summary": "apply_patch now reaches the guard and delegated edits are blocked.",
      "disposition": "fixed"
    },
    {
      "id": "R2",
      "severity": "medium",
      "summary": "Patch file directives provide evidence-path detection and a target directory.",
      "disposition": "fixed"
    },
    {
      "id": "R3",
      "severity": "medium",
      "summary": "The Pi extension resolves scripts from its module location and blocks all guard failures.",
      "disposition": "fixed"
    },
    {
      "id": "R4",
      "severity": "low",
      "summary": "Malformed hooks containers and event arrays are rejected.",
      "disposition": "fixed"
    },
    {
      "id": "R5",
      "severity": "low",
      "summary": "Regression coverage covers patch edits, Cursor paths, malformed hooks and Codex verification.",
      "disposition": "fixed"
    },
    {
      "id": "R6",
      "severity": "low",
      "summary": "Argument prose is emitted outside command backticks.",
      "disposition": "fixed"
    }
  ]
}
